{
  "$schema": "https://json-schema.org/draft/2020-12/schema",
  "$id": "https://meta-kim.dev/contracts/skills-manifest.schema.json",
  "title": "Meta_Kim Skills Manifest",
  "description": "Shared configuration for third-party skill repositories installed by Meta_Kim",
  "type": "object",
  "additionalProperties": false,
  "required": ["schemaVersion", "skillOwner", "skills"],
  "properties": {
    "schemaVersion": {
      "type": "integer",
      "minimum": 1,
      "description": "Manifest schema version"
    },
    "skillOwner": {
      "type": "string",
      "description": "Default GitHub owner/organization for skill repositories (can be overridden via META_KIM_SKILL_OWNER env var)"
    },
    "skills": {
      "type": "array",
      "description": "List of third-party skill repositories to install",
      "items": {
        "type": "object",
        "required": ["id", "repo"],
        "properties": {
          "id": {
            "type": "string",
            "description": "Unique identifier for the skill (used as directory name)"
          },
          "repo": {
            "type": "string",
            "description": "GitHub repository path (owner/repo or full URL). Can use ${skillOwner} placeholder."
          },
          "subdir": {
            "type": "string",
            "description": "Static subdirectory path where the skill is located"
          },
          "subdirTemplate": {
            "type": "string",
            "description": "Template for platform-specific subdirectory (use {platform} placeholder)"
          },
          "subdirMapping": {
            "type": "object",
            "description": "Platform-specific subdirectory mapping",
            "properties": {
              "win32": { "type": "string" },
              "darwin": { "type": "string" },
              "linux": { "type": "string" },
              "default": { "type": "string" }
            }
          },
          "claudePlugin": {
            "type": "string",
            "description": "Claude Code marketplace plugin identifier if this skill is also an official plugin"
          },
          "targets": {
            "type": "array",
            "description": "Which runtimes this skill applies to. If omitted, applies to all runtimes.",
            "items": {
              "type": "string",
              "enum": ["claude", "codex", "openclaw"]
            }
          }
        }
      }
    },
    "externalUrls": {
      "type": "object",
      "description": "External URLs referenced in Meta_Kim (for centralized management)",
      "properties": {
        "claudeCodeDocs": {
          "type": "string",
          "description": "Official Claude Code documentation URL"
        },
        "author": {
          "type": "object",
          "properties": {
            "website": { "type": "string" },
            "github": { "type": "string" },
            "feishu": { "type": "string" }
          }
        }
      }
    }
  }
}
