{
  "$schema": "./contracts/skills-manifest.schema.json",
  "schemaVersion": 1,
  "skillOwner": "KimYx0207",
  "skills": [
    {
      "id": "agent-teams-playbook",
      "repo": "${skillOwner}/agent-teams-playbook"
    },
    {
      "id": "findskill",
      "repo": "${skillOwner}/findskill",
      "subdirTemplate": "{platform}",
      "subdirMapping": {
        "win32": "windows",
        "default": "original"
      }
    },
    {
      "id": "hookprompt",
      "repo": "${skillOwner}/HookPrompt"
    },
    {
      "id": "superpowers",
      "repo": "obra/superpowers",
      "claudePlugin": "superpowers@claude-plugins-official"
    },
    {
      "id": "everything-claude-code",
      "repo": "affaan-m/everything-claude-code"
    },
    {
      "id": "planning-with-files",
      "repo": "OthmanAdi/planning-with-files",
      "subdir": "skills/planning-with-files"
    },
    {
      "id": "cli-anything",
      "repo": "HKUDS/CLI-Anything"
    },
    {
      "id": "gstack",
      "repo": "garrytan/gstack"
    },
    {
      "id": "skill-creator",
      "repo": "anthropics/skills",
      "subdir": "skills/skill-creator"
    }
  ],
  "externalUrls": {
    "claudeCodeDocs": "https://docs.anthropic.com/en/docs/claude-code",
    "author": {
      "website": "https://www.aiking.dev/",
      "github": "https://github.com/KimYx0207",
      "feishu": "https://my.feishu.cn/wiki/OhQ8wqntFihcI1kWVDlcNdpznFf"
    }
  }
}
